{
  "$schema": "http://json-schema.org/draft-07/schema#",
  "$comment": "GENERATED by gui/schema-gen/derive_nf_config_schemas.py from config/mcp-server.json + its source (ADR-0425). Do not edit; regenerate.",
  "title": "mcp-server",
  "type": "object",
  "additionalProperties": false,
  "properties": {
    "_comment": {
      "type": "string"
    },
    "pii_audit_database_url": {
      "type": "string",
      "x-env-override": "MCP_PII_AUDIT_DATABASE_URL",
      "x-cpp-type": "std::string",
      "x-sensitivity": "credential"
    },
    "balance_management_base_url": {
      "type": "string"
    },
    "chf_base_url": {
      "type": "string"
    },
    "product_catalog_base_url": {
      "type": "string"
    },
    "nrf_base_url": {
      "type": "string"
    },
    "agents": {
      "type": "object",
      "additionalProperties": false,
      "properties": {
        "customer-agent": {
          "type": "object",
          "additionalProperties": false,
          "properties": {
            "_comment": {
              "type": "string"
            },
            "tools": {
              "type": "array",
              "items": {
                "type": "string"
              }
            },
            "pinnedSubject": {
              "type": "string"
            }
          }
        },
        "revenue-agent": {
          "type": "object",
          "additionalProperties": false,
          "properties": {
            "_comment": {
              "type": "string"
            },
            "tools": {
              "type": "array",
              "items": {
                "type": "string"
              }
            }
          }
        },
        "ops-agent": {
          "type": "object",
          "additionalProperties": false,
          "properties": {
            "_comment": {
              "type": "string"
            },
            "tools": {
              "type": "array",
              "items": {
                "type": "string"
              }
            }
          }
        }
      }
    },
    "rating_database_url": {
      "type": "string",
      "x-env-override": "MCP_RATING_DATABASE_URL",
      "x-cpp-type": "std::string",
      "x-sensitivity": "credential"
    },
    "cdr_host": {
      "type": "string",
      "x-env-override": "MCP_CDR_HOST",
      "x-cpp-type": "std::string"
    },
    "cdr_port": {
      "type": "integer",
      "x-env-override": "MCP_CDR_PORT",
      "x-cpp-type": "int"
    },
    "cdr_user": {
      "type": "string",
      "x-env-override": "MCP_CDR_USER",
      "x-cpp-type": "std::string"
    },
    "cdr_password": {
      "type": "string",
      "x-env-override": "MCP_CDR_PASSWORD",
      "x-cpp-type": "std::string",
      "x-sensitivity": "credential"
    },
    "cdr_database": {
      "type": "string",
      "x-env-override": "MCP_CDR_DATABASE",
      "x-cpp-type": "std::string"
    }
  },
  "required": [
    "cdr_database",
    "cdr_host",
    "cdr_password",
    "cdr_port",
    "cdr_user",
    "pii_audit_database_url",
    "rating_database_url"
  ],
  "x-config-file": "config/mcp-server.json",
  "x-source": [
    "tools/mcp-server"
  ],
  "x-apply": "restart",
  "x-review": [
    "_comment: present in the file but no source line visibly reads it",
    "balance_management_base_url: present in the file but no source line visibly reads it",
    "chf_base_url: present in the file but no source line visibly reads it",
    "product_catalog_base_url: present in the file but no source line visibly reads it",
    "nrf_base_url: present in the file but no source line visibly reads it",
    "agents: nested object shape inferred from current values (map-vs-struct meaning unverified; new keys refused until reviewed)",
    "agents.customer-agent: nested object shape inferred from current values (map-vs-struct meaning unverified; new keys refused until reviewed)",
    "agents.revenue-agent: nested object shape inferred from current values (map-vs-struct meaning unverified; new keys refused until reviewed)",
    "agents.ops-agent: nested object shape inferred from current values (map-vs-struct meaning unverified; new keys refused until reviewed)"
  ]
}
